link,text,username,user,likes,quotes,retweets,comments
https://twitter.com/mustafasuleyman/status/1770123596121432351#m,"I’m excited to announce that today I’m joining @Microsoft as CEO of Microsoft AI. I’ll be leading all consumer AI products and research, including Copilot, Bing and Edge. My friend and longtime collaborator Karén Simonyan will be Chief Scientist, and several of our amazing…",mustafasuleyman,Mustafa Suleyman,15837,607,1547,1010
https://twitter.com/mustafasuleyman/status/1801291478729138492#m,"AI should be a catalyst for real progress, but too often we haven't seen that. One of the good things about being at @Microsoft is seeing the sheer breadth of effort behind the scenes, particularly with our AI for Good initiatives.   This is AI making a difference to the…",mustafasuleyman,Mustafa Suleyman,194,3,36,34
https://twitter.com/mustafasuleyman/status/1800914490797515025#m,Very exciting and thoughtful work coming from colleagues @Github. They've already done so much to transform how we build software... But it really is only the start as Workplace makes clear. What I like here is the way it drafts a plan that then gets approved by users. A model…,mustafasuleyman,Mustafa Suleyman,72,0,0,4
https://twitter.com/mustafasuleyman/status/1800549053064773889#m,"Last week @Bing turned 15 years old. Everyone on the team should feel super proud of the incredible work over the years. As I said to them, I think Bing is incredibly underrated by the tech world who haven't caught up with how good it is. Congrats to everyone at Bing, a huge…",mustafasuleyman,Mustafa Suleyman,187,2,10,17
https://twitter.com/mustafasuleyman/status/1793072472285458822#m,"‘Browsing’ is about to be completely transformed. Finally, our AIs have learnt to speak our languages, and actually see what we see.  This demo is particularly close to my heart. It completes work that I started at DeepMind back in 2011.",mustafasuleyman,Mustafa Suleyman,472,19,77,41
https://twitter.com/mustafasuleyman/status/1793074632603611646#m,"Just think, 15 years ago, AI could hardly recognize a single object in a 256x256 image.",mustafasuleyman,Mustafa Suleyman,34,0,3,2
https://twitter.com/mustafasuleyman/status/1793072569836597418#m,"Our first product was a fashion search engine that allowed you to browse similar colors, patterns and styles. It was too early for deep learning back then.  But now to see it come to fruition is just surreal.  It’s like having a partner to think out loud with, infinitely patient,…",mustafasuleyman,Mustafa Suleyman,30,1,2,1
https://twitter.com/yusuf_i_mehdi/status/1792974447969968298#m,"We’re reimagining what @MSFTCopilot, your everyday AI companion, can do in @Windows. It will be an app like experience that is simpler and more personal, showing up when and where you need it.",mustafasuleyman,Yusuf Mehdi,215,2,36,11
https://twitter.com/mustafasuleyman/status/1792624537630290119#m,Standby for more details on the full spectrum of capabilities we are demoing today; they’re coming to every Copilot very soon.  This is an incredibly exciting time. I want to pay tribute to the teams at @Microsoft and @OpenAI who are making this possible.  And especially to…,mustafasuleyman,Mustafa Suleyman,99,1,5,5
https://twitter.com/mustafasuleyman/status/1792624197572653351#m,"Microsoft changed computing history by inventing a new category: the Personal Computer or PC.  Now we’re re-inventing PCs for the AI era, taking us from personal computing to truly personal intelligence.  Today we’re launching a new product category: Copilot+ PCs, the biggest…",mustafasuleyman,Mustafa Suleyman,138,43,25,86
https://twitter.com/mustafasuleyman/status/1792624015372333240#m,"Real personality. Effortless interactions. The ability to see what we see.  ✨  I’ve long argued that AIs with EQ, IQ and AQ are coming. Here’s the first real glimpse of what’s its gonna feel like.  It’s a magical experience: smart, intuitive, natural, and useful.",mustafasuleyman,Mustafa Suleyman,100,2,4,6
https://twitter.com/mustafasuleyman/status/1792623877744623806#m,"We are taking Copilot to the next level. 🚀  Copilot will see, hear, speak and help in real time.  Watch this demo to see what I mean. Soon your AI companion will start to live life alongside you, whether playing Minecraft or helping you navigate life’s most difficult challenges.…",mustafasuleyman,Mustafa Suleyman,1581,144,294,135
https://twitter.com/mustafasuleyman/status/1788980752391999935#m,"Responsible AI: ""The benefits are incredible. The challenge is how to mitigate the downsides"" https://edition.cnn.com/videos/tech/2024/01/07/gps-0107-mustafa-suleyman-on-regulating-ai.cnn",mustafasuleyman,Mustafa Suleyman,114,4,17,16
https://twitter.com/satyanadella/status/1785714562601529831#m,"We’re committed to building and deploying AI responsibly and helping others do the same, which is why we’re sharing details about our approach in this inaugural report.",mustafasuleyman,Satya Nadella,793,9,106,41
https://twitter.com/mustafasuleyman/status/1788217936207044934#m,"Copilot Workspace: ""a refined wined..."" 😍",mustafasuleyman,Mustafa Suleyman,114,2,10,7
https://twitter.com/mustafasuleyman/status/1787772379994710081#m,Biomimicry can never be underrated as an inspiration for technology (including AI). Almost always nature has found an answer first e.g. a snail robot to scoop up microplastics. https://news.cornell.edu/stories/2023/12/snail-inspired-robot-could-scoop-ocean-microplastics,mustafasuleyman,Mustafa Suleyman,60,0,12,11
https://twitter.com/mustafasuleyman/status/1786143433720996081#m,"Well worth a listen, super interesting as you would expect. Some of the best minds (and all round people) in AI and tech.",mustafasuleyman,Mustafa Suleyman,173,1,29,10
https://twitter.com/mustafasuleyman/status/1787581966931353755#m,"5/5 At Microsoft AI we are up for this. We are building products and shaping a future of massive positive impact. It's still only the beginning of a long journey ahead, but we have a vision for Copilot that is ambitious and, we believe, truly transformational. I couldn't be more…",mustafasuleyman,Mustafa Suleyman,174,2,10,14
https://twitter.com/mustafasuleyman/status/1787581699192221890#m,4/5 Responsible AI is a cornerstone. Everyone is working hard to define new norms and everyone I've met feels a deep responsibility to do so with an open heart and a humble mind... Massive kudos to all the teams working on this!,mustafasuleyman,Mustafa Suleyman,142,0,12,5
https://twitter.com/mustafasuleyman/status/1787581393284862228#m,"3/5 AI is everything here. @satyanadella and @kevin_scott been so clear about this. Microsoft is a truly AI-first business driving the biggest technological transformation of our time. I knew this already of course... But seeing this in practice, at this scale, is impressive.",mustafasuleyman,Mustafa Suleyman,145,2,15,2
https://twitter.com/mustafasuleyman/status/1787580894611484900#m,2/5 The company is defined by a genuinely supportive and strong culture from top to bottom. It's rare to see this at any scale of business. But it's made joining and getting used to everything super easy. Thank you to everyone for being so welcoming (and patient) as we've been…,mustafasuleyman,Mustafa Suleyman,133,1,11,2
https://twitter.com/mustafasuleyman/status/1787580620694077639#m,"1/5 I've been at Microsoft for just over a month. It's been an exhilarating journey getting to know a huge number of people, organizations and projects, without doubt one of the most exciting and fulfilling times I’ve ever experienced.  Here's a few things I've learned:",mustafasuleyman,Mustafa Suleyman,764,9,69,37
https://twitter.com/TEDTalks/status/1782535583446790584#m,What is an AI anyway? Microsoft AI CEO @mustafasuleyman offers a compelling new vision for the future.  Learn more about where AI is heading by watching his full #TED2024 Talk here: t.ted.com/8S2AAYE,mustafasuleyman,TED Talks,308,23,121,42
https://twitter.com/mustafasuleyman/status/1782447682780303466#m,“What actually is an AI anyway?” Had fun thinking about this question for my @TEDTalks talk which is out now… New technologies need new metaphors. https://www.ted.com/talks/mustafa_suleyman_ai_is_turning_into_something_totally_new,mustafasuleyman,Mustafa Suleyman,272,9,64,37
https://twitter.com/FutureJurvetson/status/1782201734158524435#m,"The new CEO of Microsoft AI, @MustafaSuleyman, with a $100B budget at TED:  ""AI is a new digital species.""  ""To avoid existential risk, we should avoid: 1) Autonomy 2) Recursive self-improvement 3) Self-replication We have a good 5 to 10 years before we'll have to confront this.""",mustafasuleyman,Steve Jurvetson,921,314,143,247
https://twitter.com/JordanHarbinger/status/1775294214542094513#m,"How has #AI become the 21st century's greatest dilemma? Microsoft AI CEO and ""The Coming Wave"" author @mustafasuleyman weighs in!  Notes https://buff.ly/3VJQPYe  Apple https://buff.ly/3VJQNzA  Spotify https://buff.ly/4a9RE0F  Overcast https://buff.ly/3VJQNQ6",mustafasuleyman,Jordan Harbinger,42,1,13,5
https://twitter.com/FareedZakaria/status/1777844280671043757#m,"A  super smart, lively discussion with @mustafasuleyman — you can watch on YouTube, link below.",mustafasuleyman,Fareed Zakaria,102,0,12,5
https://twitter.com/mustafasuleyman/status/1777823259615998444#m,"Had a fantastic conversation with @FareedZakaria last night about his best-selling new book, Age of Revolutions... I asked him about Biden, Trump and what the French revolution has to teach us about compromise in the 21st Century... https://piped.video/watch?v=EY-8g-wEXQg",mustafasuleyman,Mustafa Suleyman,97,1,18,5
https://twitter.com/mustafasuleyman/status/1777403646898057220#m,"Looking forward to chatting to @FareedZakaria about his excellent new book, Age of Revolutions. Covering 400 years of turbulence and revolutions from the political to the technological, it makes clear what a pivotal time we live in. Can’t wait to dive in tonight @cwclub!",mustafasuleyman,Mustafa Suleyman,128,1,5,7
https://twitter.com/michelledonelan/status/1777326281220112539#m,.@Microsoft making London home to its new AI hub is another huge vote of confidence in the UK’s status as a global leader in AI and our mission to develop it safely – driving innovation and growth across the country 🇬🇧  https://blogs.microsoft.com/blog/2024/04/07/announcing-new-microsoft-ai-hub-in-london/,mustafasuleyman,Michelle Donelan,133,7,49,71
https://twitter.com/BBCTech/status/1777264389889884653#m,Microsoft announces new AI office in UK https://bbc.in/4cOEyYn,mustafasuleyman,BBC News Technology,230,2,63,16
https://twitter.com/mustafasuleyman/status/1777341903597617506#m,"The UK has phenomenal AI talent and a long established culture of responsible AI development.   Today I’m proud to be opening a new office: Microsoft AI London. If you’d like to join us, get in touch. We’re hiring!  https://blogs.microsoft.com/blog/2024/04/07/announcing-new-microsoft-ai-hub-in-london/",mustafasuleyman,Mustafa Suleyman,2033,61,280,101
https://twitter.com/reidhoffman/status/1770190654301433940#m,"It’s a good day for everyone involved in @inflectionAI. I am excited to work with incoming CEO @seanwhite, who’s been a friend and colleague for more than 20 years. Under Sean’s leadership, Inflection will continue on its mission and will reach more people than ever by making its…",mustafasuleyman,Reid Hoffman,429,20,48,30
https://twitter.com/satyanadella/status/1770132249029357569#m,"Welcome to Microsoft, @mustafasuleyman. Thrilled to have you lead Microsoft AI as we build consumer AI, like Copilot, that is loved by and benefits people around the world.",mustafasuleyman,Satya Nadella,6329,153,624,292
https://twitter.com/inflectionAI/status/1768328750075412861#m,"Happy #PiDay, let's toast to infinite adventures with @pi - now available on 13 platforms.   Ready for wherever life’s adventures take you. Cheers to 3.14 and beyond!   https://inflection.ai/pi-is-available-wherever-you-are",mustafasuleyman,Inflection AI,144,2,14,18
https://twitter.com/mustafasuleyman/status/1768356742436392978#m,"I'll never not be surprised by some of the uncanny echoes of personhood exhibited by AI. For example, scientists feed random data to AI during ""sleep"" periods, sparking new connections and boosting creative problem-solving. Research shows new training method inspired by human…",mustafasuleyman,Mustafa Suleyman,234,4,32,27
https://twitter.com/JolyonMaugham/status/1767144006016717182#m,"Have just finished this, by @mustafasuleyman, about what, like it or not, tech has in store for humanity.   Superbly researched. But engaging because, I suspect, his background means he knows who will float and who will be engulfed by 'The Coming Wave'. https://www.the-coming-wave.com/",mustafasuleyman,Jo Maugham,116,3,28,7
https://twitter.com/mustafasuleyman/status/1767550900288069984#m,"Anyone arguing that AI isn't tackling major challenges isn't paying attention. Everyone knows batteries are integral to the clean energy transition but aren't where we need them to be. Now we're seeing serious strides in new battery materials thanks to AI, which narrowed 32…",mustafasuleyman,Mustafa Suleyman,473,10,91,24
https://twitter.com/mustafasuleyman/status/1767144190297665837#m,"Everyone is going to be represented by AI. You are going to have AI representing your interests on your behalf, presenting your brand value, your ideas…it will be your interlocutor the-coming-wave.com",mustafasuleyman,Mustafa Suleyman,175,8,24,25
https://twitter.com/balajis/status/1766213113089581299#m,"Suddenly, GPT4 has four competitors.  - Gemini 1.5 - Mistral Large - Claude 3 Opus - Inflection-2.5  Links below. All are impressive. I like Claude the best. https://simonwillison.net/2024/Mar/8/gpt-4-barrier/",mustafasuleyman,Balaji,2813,49,456,100
https://twitter.com/mustafasuleyman/status/1765753606395818403#m,"Meet the new, upgraded Pi! Give it a go at pi.ai",mustafasuleyman,Mustafa Suleyman,459,5,46,40
https://twitter.com/mustafasuleyman/status/1765755401390223541#m,"Millions of users, billions of messages. Meet the new, upgraded Pi where helpful IQ blends with friendly EQ.  Now powered by our world class foundation model: Inflection-2.5",mustafasuleyman,Mustafa Suleyman,309,4,35,34
https://twitter.com/HeinrichKuttler/status/1765783020957548549#m,We released an improved MT-Bench at https://github.com/InflectionAI/Inflection-Benchmarks. Some questions and reference answers were nonsensical or wrong before. Here's an overview:,mustafasuleyman,heiner,102,2,9,12
https://twitter.com/inflectionAI/status/1765758267500970393#m,"Evaluation is everything! While testing Inflection-2.5, we found that MT-Bench has a bunch of incorrect answers.  Here we share the corrections for everyone to use, and we release a new Physics GRE benchmark for people to try out. https://inflection.ai/inflection-2-5",mustafasuleyman,Inflection AI,337,16,47,17
https://twitter.com/mustafasuleyman/status/1765422775307554948#m,"Language, agriculture, writing—each was a general-purpose technology at the center of an early wave. These three waves formed the foundation of civilization as we know it. Now we take them for granted. It will be the same for AI. the-coming-wave.com",mustafasuleyman,Mustafa Suleyman,96,6,12,8
https://twitter.com/mustafasuleyman/status/1765188040430141597#m,The Coking Wave arrived in Korea! 🤓,mustafasuleyman,Mustafa Suleyman,87,1,3,18
https://twitter.com/NasscomEvents/status/1759813708933419254#m,"It's the best time to be an inventor and a creator!    @mustafasuleyman, AI thought-leader reflects on AI's vast potential - from mundane gadgets to varied industries.   ""We were fundamentally long term thinkers from the beginning and we resisted the temptation to optimize for…",mustafasuleyman,nasscom events,19,0,4,3
https://twitter.com/mustafasuleyman/status/1760241970767626263#m,Therapeutic breakthroughs & new insights are rising because the costs of sequencing are plummeting. The trajectories of technologies like AI and bio are stark and powerful. Read them and we read the future. https://www.globalxetfs.com/charting-disruption-medical-breakthroughs/,mustafasuleyman,Mustafa Suleyman,56,0,8,3
https://twitter.com/mustafasuleyman/status/1760012640666169434#m,"Costs in areas like healthcare and education have, for basic economic reasons, outstripped inflation for years. At some stage they will become unaffordable, to societies and many households. It would be crazy to say AI has all the answers. It's equally crazy to believe that we…",mustafasuleyman,Mustafa Suleyman,127,0,25,17
https://twitter.com/mustafasuleyman/status/1758559880791617853#m,"Find the ""AI partner that completes you"". Welcome to the @pi fan club!https://www.forbes.com/sites/forbesbooksauthors/2024/02/05/piai-vs-chatgpt-why-i-am-cheating-on-my-first-ai/?sh=74e566572c27",mustafasuleyman,Mustafa Suleyman,110,2,14,18
https://twitter.com/mustafasuleyman/status/1759518761554526716#m,"""If you really focus on creating an AI that's smooth, conversational, fluent, very even-handed and balanced, it turns out it's possible to do it. Pi very kind, balanced and friendly and that demonstrates that we can actually control these AI systems."" https://edition.cnn.com/videos/tv/2024/02/01/amanpour-mustafa-suleyman-artificial-intelligence.cnn",mustafasuleyman,Mustafa Suleyman,83,3,13,12
https://twitter.com/inflectionAI/status/1758577761328017853#m,"We welcome the Tech Accord to Combat Deceptive Use of AI in 2024 Elections.   In a year of unprecedented elections around the world, trust and transparency are more important than ever to democracy.",mustafasuleyman,Inflection AI,50,1,9,9
https://twitter.com/SZ/status/1758488520119775675#m,"Ein Interview von @akreye mit Mustafa Suleyman über sein Buch ""The Coming Wave"" und den historischen Moment, wenn sich KI, Robotik und Biotech vereinen. #SZPlus https://sz.de/1.6350555?utm_source=Twitter&utm_medium=twitterbot&utm_campaign=6350555",mustafasuleyman,Süddeutsche Zeitung,9,0,1,1
https://twitter.com/mastersofscale/status/1755783982828994932#m,Ready for a future where I can ask my friends and colleagues less stupid questions. 😁🙏  Are you excited about the future of AI? Join us on Feb 29 for the first-ever Masters of AI Day!  Learn more & register: hubs.la/Q02jqctf0  🎥 @inflectionAI co-founder @mustafasuleyman,mustafasuleyman,Masters of Scale,35,0,4,4
https://twitter.com/inflectionAI/status/1755697186061287843#m,We welcome NIST’s AI Safety Institute. Safety sits at the heart of our mission and culture at Inflection.   We’re excited to share our expertise as part of the AI Safety Institute Consortium to help ensure that AI benefits everyone. #AISIC,mustafasuleyman,Inflection AI,43,2,3,7
https://twitter.com/mustafasuleyman/status/1754442213126205688#m,AIs will have infinitely more capable sensors than humans... check out this paper showing super-resolution cancer cell detection in pathology slides. https://www.pennmedicine.org/news/news-releases/2024/january/ai-tool-brings-precision-pathology-for-cancer-into-focus,mustafasuleyman,Mustafa Suleyman,109,0,14,8
https://twitter.com/amanpour/status/1753824556555395512#m,"Would you let @elonmusk chip your brain? @inflectionAI’s @mustafasuleyman, who co-founded @GoogleDeepMind, isn’t ruling it out.  Hear our fascinating conversation on everything from deepfake porn to Putin’s digital doppelganger. #TheAmanpourHour airs 11aET Saturdays on @CNN",mustafasuleyman,Christiane Amanpour,128,3,39,17
https://twitter.com/mustafasuleyman/status/1753480471470580053#m,"""I believe these technologies can deliver an extraordinary amount of good. But without what I call containment, every other aspect of a technology, every discussion of its ethical shortcomings, or the benefits it could bring, is inconsequential."" https://www.wired.com/story/ai-containment-regulation-suleyman/",mustafasuleyman,Mustafa Suleyman,44,1,8,6
https://twitter.com/mustafasuleyman/status/1752749666406445417#m,"It’s actually quite incredible to be alive at this moment. It’s hard to fully absorb the enormity of this transition. Despite the incredible impact of AI recently, the world is still struggling to appreciate how big a deal its arrival really is. We are in the process of seeing a…",mustafasuleyman,Mustafa Suleyman,555,22,98,51
https://twitter.com/mustafasuleyman/status/1753117091194961925#m,"Researchers at Weill Cornell Medicine are harnessing AI to explore the universe's most complex known object, the human brain. Using AI-selected natural and synthetic images, they delve into the visual processing areas, aiming to understand organization and minimize biases. We…",mustafasuleyman,Mustafa Suleyman,75,2,8,7
https://twitter.com/mustafasuleyman/status/1752268374405448123#m,"General purpose technologies are the closest thing we have to magic.   Each has given us more with less - and propelled civilization forward. Check out this list of 24 over the last 10,000 years  - Domestication of plants  - Domestication of animals  - Smelting of ore  - Money  -…",mustafasuleyman,Mustafa Suleyman,174,3,42,20
https://twitter.com/mustafasuleyman/status/1752270319820087385#m,"In just a few years, cutting-edge models have gone from using millions of parameters to trillions.   The amount of computation used to train the largest AI models has increased by nine orders of magnitude.   Here's what we should do next: https://www.foreignaffairs.com/world/containment-ai",mustafasuleyman,Mustafa Suleyman,40,0,7,4
https://twitter.com/mustafasuleyman/status/1752015605534769533#m,"Worth a look - this AI model spots hidden signs of irregular heartbeats in regular ECGs, catching risks standard tests miss. https://www.sciencedaily.com/releases/2023/12/231212163357.htm",mustafasuleyman,Mustafa Suleyman,79,1,18,7
https://twitter.com/mustafasuleyman/status/1751755939659571243#m,"Starting to crash around us is a new wave of technology. This wave is unleashing the power to engineer two universal foundations: a wave of nothing less than intelligence, and life...What if the wave is actually a tsunami?",mustafasuleyman,Mustafa Suleyman,135,1,20,18
https://twitter.com/mustafasuleyman/status/1750942911573750009#m,"I've long argued that one of the most consequential relationships of the century will be between AI and biology. This nexus, as much as any other, will shape our lives in deep and unpredictable ways. Exhibit #5672: research integrates AI with super-resolution microscopy,…",mustafasuleyman,Mustafa Suleyman,202,4,44,10
https://twitter.com/mustafasuleyman/status/1750490168832758070#m,"AI - believe the hype, don't believe the hype. Let's get to work anyway https://www.cnbc.com/video/2024/01/17/weve-hit-peak-hype-of-the-ai-revolution-says-deepmind-co-founder-mustafa-suleyman.html",mustafasuleyman,Mustafa Suleyman,45,0,8,2
https://twitter.com/mustafasuleyman/status/1750281432826576969#m,"""Eliminate methane emissions today, and you can quickly impact the curve of global warming."" Methane is terrible for the environment, far worse than CO2. Encouraging that dozens of leaks are now detected by AI weekly. This is exactly the kind of AI application we need: solving…",mustafasuleyman,Mustafa Suleyman,69,4,13,10
https://twitter.com/mustafasuleyman/status/1749821316402676065#m,"""ACI has the potential to give everyone access to the world’s best assistant, chief of staff, lawyer, doctor, and all-around A-team."" latest essay for @ForeignAffairs https://www.foreignaffairs.com/world/containment-ai",mustafasuleyman,Mustafa Suleyman,70,2,15,4
https://twitter.com/ForeignAffairs/status/1749974090184544426#m,"“Most people rightly argue that AI regulation is necessary, and there is a tendency to believe that it is enough. It is not.” Read @mustafasuleyman on the case for containing artificial intelligence:  https://trib.al/gO1cXp6",mustafasuleyman,Foreign Affairs,17,0,3,2
https://twitter.com/mustafasuleyman/status/1748761808377180276#m,Absolutely nuts to see how good genAI is getting. This is gripping:  https://www.reddit.com/r/ChatGPT/s/K4qJlnbF9l,mustafasuleyman,Mustafa Suleyman,303,6,42,14
https://twitter.com/mustafasuleyman/status/1749432008197972457#m,"Chief Justice Roberts: AI won't replace lawyers, but legal research will become ""unimaginable"" without it He's right on both counts but this understates how radically the legal profession will be transformed. Lawyers have been insulated from disruption, but this isn't a healthy…",mustafasuleyman,Mustafa Suleyman,129,11,18,17
https://twitter.com/mustafasuleyman/status/1749011680913191353#m,"""AI may become the first technology with the means to improve on itself."" Hard to think of a more consequential moment than this. https://www.imf.org/en/Publications/fandd/issues/2023/12/POV-building-blocks-for-AI-governance-Bremmer-Suleyman",mustafasuleyman,Mustafa Suleyman,165,2,34,12
https://twitter.com/wef/status/1747592857819713626#m,"Town Hall: How to Trust Technology with @robotsmarts (@OhioState), @mustafasuleyman (@InflectionAI) and @benthompson (@stratechery) #wef24 https://nitter.kavin.rocks/i/broadcasts/1djxXNDONqjGZ",mustafasuleyman,World Economic Forum,39,4,11,1
https://twitter.com/mustafasuleyman/status/1748624740304982382#m,"""These tools allow us to do things that software have never been able to do before. They are creative, empathetic, and they act much more like humans than a traditional database"". Enjoyed chatting with @andrewrsorkin @SquawkCNBC today at Davos #WEF24 https://www.cnbc.com/video/2024/01/17/weve-hit-peak-hype-of-the-ai-revolution-says-deepmind-co-founder-mustafa-suleyman.html",mustafasuleyman,Mustafa Suleyman,41,1,12,2
