link,text,username,user,likes,quotes,retweets,comments
https://twitter.com/mustafasuleyman/status/1698793409601757338#m,AI is rocket fuel for invention.   Our most productive decade ever is on its way  https://www.nature.com/articles/s41586-023-06221-2/,mustafasuleyman,Mustafa Suleyman,279,4,67,8
https://twitter.com/mustafasuleyman/status/1748624508804575480#m,Look around you. Almost everything you see has been touched by intelligence. And its cost is plummeting at an unprecedented rate. Something profound is shifting.  https://finance.yahoo.com/news/mustafa-suleyman-wants-balance-ai-070000959.html?guccounter=1,mustafasuleyman,Mustafa Suleyman,114,4,14,20
https://twitter.com/wef/status/1747602244428611871#m,.@mustafasuleyman (@InflectionAI) outlines the two elements that drive trust in new consumer technologies. #wef24,mustafasuleyman,World Economic Forum,44,2,18,1
https://twitter.com/wef/status/1748019491160858745#m,"Hard Power of AI with @nickclegg (@Meta), @KGeorgieva (@IMFnews), Jeremy Jurgens, @DmytroKuleba (@MFA_Ukraine), @andrewrsorkin (@NYTimes), @mustafasuleyman (@InflectionAI), @k_edtstadler and @LeoVaradkar #wef24 https://nitter.kavin.rocks/i/broadcasts/1kvJpvLeQNQKE",mustafasuleyman,World Economic Forum,125,11,56,17
https://twitter.com/SquawkCNBC/status/1747588962401636409#m,"""AI is truly one of the most incredible technologies of our lifetime,"" says DeepMind Co-Founder @MustafaSuleyman. ""But at the same time, it feels like expectations about its delivery are higher than they've ever been, and maybe we have hit a kind of peak hype for this moment.""",mustafasuleyman,Squawk Box,126,4,35,18
https://twitter.com/mustafasuleyman/status/1744695816281809329#m,"""Tools and invention are going to make us more capable as a species... and that's what drew me to AI in the first place"" Chatting with @FareedZakaria https://edition.cnn.com/videos/tech/2024/01/07/gps-0107-suleyman-on-the-future-of-ai.cnn",mustafasuleyman,Mustafa Suleyman,50,2,8,7
https://twitter.com/FareedZakaria/status/1744356044854149455#m,Great conversation and a great book by @mustafasuleyman,mustafasuleyman,Fareed Zakaria,91,3,14,10
https://twitter.com/FareedZakaria/status/1744081903945126176#m,"Will AI return humans to their pre-Enlightenment selves? By contrast, what miraculous benefits will it entail?   Part 2 of my conversation w/ AI entrepreneur & ”The Coming Wave” author @mustafasuleyman, from today’s show",mustafasuleyman,Fareed Zakaria,140,8,53,15
https://twitter.com/mustafasuleyman/status/1744299424967225505#m,Awesome to see The Coming Wave riding high at lucky #7 on the Amazon Best Sellers list.   Thank you to everyone who’s bought it! 🌊,mustafasuleyman,Mustafa Suleyman,88,0,7,12
https://twitter.com/mustafasuleyman/status/1744272312973640062#m,Really enjoyed having this detailed and wide ranging conversation about the future of personal intelligence with @FareedZakaria. Great to see you Fareed!,mustafasuleyman,Mustafa Suleyman,103,2,39,7
https://twitter.com/inflectionAI/status/1742958000229277981#m,🥂 Cheers to a year of innovation.🚀 Check out the game-changing capabilities of Pi – and try it out for yourself: Pi.ai,mustafasuleyman,Inflection AI,157,9,35,33
https://twitter.com/mustafasuleyman/status/1742237172579573788#m,“Reading the audiobook himself with an Englishness that is both convincing and comforting to the ears of an American” - Thanks @CadeMetz for the @NYTimes audiobook of the week review! https://www.nytimes.com/2023/12/29/books/review/mustafa-suleyman-the-coming-wave.html,mustafasuleyman,Mustafa Suleyman,31,0,2,4
https://twitter.com/mustafasuleyman/status/1741781520249999417#m,Thank you @harari_yuval,mustafasuleyman,Mustafa Suleyman,131,1,19,6
https://twitter.com/mastersofscale/status/1740038935294902634#m,"Where is the trajectory of AI innovation headed in 2024 and beyond?   According to @mustafasuleyman, it's up to us.  Listen to Empathy in AI with co-founders of @inflectionAI, @mustafasuleyman and @reidhoffman: listen.mastersofscale.com/mu…",mustafasuleyman,Masters of Scale,64,1,16,4
https://twitter.com/mustafasuleyman/status/1741073733748507065#m,"Just as everything from the steam engine to the microprocessor was driven by an intense dialogue between physics and engineering, so the coming decades will be defined by a convergence of biology and engineering",mustafasuleyman,Mustafa Suleyman,315,4,57,20
https://twitter.com/mustafasuleyman/status/1740774129727361341#m,the-coming-wave.com,mustafasuleyman,Mustafa Suleyman,137,4,20,13
https://twitter.com/mustafasuleyman/status/1740397461791781055#m,"Whether it’s commercial, religious, cultural, or military, democratic or authoritarian, every possible motivation can be dramatically enhanced by having cheaper power at your fingertips. These tools will be available to all, a proliferation of not just technology but capability…",mustafasuleyman,Mustafa Suleyman,114,3,17,5
https://twitter.com/EricTopol/status/1740093631401517119#m,My top 10 books for 2023 @abe_verghese @peteratmsr @mustafasuleyman @DoctorChrisVT @PeterAttiaMD @kkariko @drfeifei @PeterHotez @DavidFajgenbaum @AnupamBJena @ChrisWorsham,mustafasuleyman,Eric Topol,922,7,171,3
https://twitter.com/mustafasuleyman/status/1739762345310646428#m,"In my essay w/ @IanBremmer  How AI Could Upend Geopolitics, we argue that AI will transform power and who can wield it. Policymakers are already behind the curve. Read or listen at @ForeignAffairs https://www.foreignaffairs.com/podcasts/how-ai-could-upend-geopolitics-ian-bremmer-mustafa-suleyman",mustafasuleyman,Mustafa Suleyman,177,5,38,12
https://twitter.com/mustafasuleyman/status/1739962514278920339#m,"""We’ve basically taken emotional intelligence and distilled it. And I think that is going to unlock the creativity of millions and millions of people for whom that wasn’t available.” Talking AI and @heypi_ai with @guardian https://www.theguardian.com/books/2023/sep/02/i-hope-im-wrong-the-co-founder-of-deepmind-on-how-ai-threatens-to-reshape-life-as-we-know-it",mustafasuleyman,Mustafa Suleyman,205,5,48,15
https://twitter.com/mustafasuleyman/status/1739419354419036383#m,"Crashing around us is a new wave of technology. This wave is unleashing the power to engineer two universal foundations: a wave of nothing less than intelligence, and life the-coming-wave.com",mustafasuleyman,Mustafa Suleyman,169,3,24,16
https://twitter.com/mustafasuleyman/status/1738262343929208924#m,It has been quite a year! Thanks to all our readers and audiobook listeners. @michaelbhaskar 👊,mustafasuleyman,Mustafa Suleyman,195,3,15,19
https://twitter.com/mustafasuleyman/status/1738181175884005576#m,"The future isn't written, it's created. Let's embrace AI and build a world that's healthier, smarter, and more sustainable.",mustafasuleyman,Mustafa Suleyman,342,5,60,23
https://twitter.com/mustafasuleyman/status/1737960609830863111#m,"Forget blurry x-rays & guesswork!  AI is now spotting tooth decay 5 years earlier!  From personalized treatment plans to remote consultations, AI is revolutionizing dental care. https://hsdm.harvard.edu/news/climate-change-cavities-ai-changing-oral-health",mustafasuleyman,Mustafa Suleyman,170,1,29,9
https://twitter.com/mustafasuleyman/status/1737459500829819165#m,Thank you Es Devlin. https://edition.cnn.com/style/best-books-2023-tastemakers/index.html,mustafasuleyman,Mustafa Suleyman,27,0,1,4
https://twitter.com/mustafasuleyman/status/1737252526238343564#m,AI's not sci-fi. Look around. It's transforming our world.,mustafasuleyman,Mustafa Suleyman,219,2,29,37