link,text,username,user,likes,quotes,retweets,comments
https://twitter.com/ylecun/status/1798057922397946163#m,Excellent report on the proper way to use AI in Science.  As usual in machine learning: don't be fooled by good results obtained by testing on the training set.,ylecun,Yann LeCun,921,5,273,19
https://twitter.com/boztank/status/1798025937684217931#m,"Starting to roll out Quest v66 with improvements to Passthrough distortion, virtual hand alignment, background audio, and more.  https://www.meta.com/blog/quest/meta-quest-v66-software-update-reduced-passthrough-distortion-background-audio",ylecun,Boz,767,38,79,77
https://twitter.com/Michael_J_Black/status/1797858964035572098#m,Entrepreneurs and academics have more in common than many people realize.  1. Both imagine some future that doesn't yet exist and seems impossible to others.  2. The really important new ideas are uncomfortable to the establishment and will face resistance. Disruption scares…,ylecun,Michael Black,243,6,39,12
https://twitter.com/ylecun/status/1798037202997481490#m,False prophecies have very real consequences.,ylecun,Yann LeCun,616,8,80,96
https://twitter.com/ylecun/status/1798007112204988611#m,Super session avec Matthieu Stefani sur son podcast Génération Do It Yourself. Une excellente discussion en profondeur sur l'IA.,ylecun,Yann LeCun,115,1,8,7
https://twitter.com/ylecun/status/1797992013054537738#m,APEJ: Architecture à Prédiction d'Enchâssement Joint. JEPA: Joint Embeddig Predictive Architecture.,ylecun,Yann LeCun,250,5,18,48
https://twitter.com/ylecun/status/1797967705976508594#m,"No risk, no reward. Corollary: A watched pot never boils. Keep asking researchers for milestones, and you'll never get breakthroughs.",ylecun,Yann LeCun,775,15,86,48
https://twitter.com/ylecun/status/1797966840733589518#m,A key inspiration for convolutional neural nets.,ylecun,Yann LeCun,1700,9,150,49
https://twitter.com/ylecun/status/1797966583517876527#m,Amusing. Remember when NIPS selected papers based on a 3-page abstract?,ylecun,Yann LeCun,96,1,5,8
https://twitter.com/JeanRemiKing/status/1797876586496327949#m,How the brain compose minimal phrases.  Go check out @AriannaZuanazzi 's study,ylecun,Jean-Rémi King,306,3,47,5
https://twitter.com/Duderichy/status/1797633261625393225#m,There's only ~200 photons per bit received from voyager... that's insane...,ylecun,the Rich,4569,47,502,52
